{
 "_leia": "Kit de teste neutro (tests/test_marca.py): empresa fictícia, fundo claro, destaque azul, fonte de teste com nome próprio (o arquivo é a Hanken Grotesk, OFL) para provar a injeção pelo FontFace, logos geométricos sem texto.",
 "versao": 1,
 "nome": "Empresa Exemplo",
 "estilo_base": "editorial",
 "cores": {
  "fundo": "#F4F1EA",
  "texto": "#1B1B1F",
  "destaque": "#2456C7",
  "superficie": null,
  "texto_apoio": null
 },
 "destaque_unico": true,
 "fontes": {
  "titulo": {
   "familia": "Fonte Teste Titulo",
   "peso": 700,
   "licenca": "OFL",
   "licenca_arquivo": "fontes/OFL.txt",
   "arquivos": [
    {
     "arquivo": "fontes/HankenGrotesk-latin.woff2",
     "peso": "400 700",
     "unicode_range": "U+0000-00FF, U+0131, U+0152-0153, U+02BB-02BC, U+02C6, U+02DA, U+02DC, U+0304, U+0308, U+0329, U+2000-206F, U+20AC, U+2122, U+2191, U+2193, U+2212, U+2215, U+FEFF, U+FFFD"
    },
    {
     "arquivo": "fontes/HankenGrotesk-latin-ext.woff2",
     "peso": "400 700",
     "unicode_range": "U+0100-02BA, U+02BD-02C5, U+02C7-02CC, U+02CE-02D7, U+02DD-02FF, U+0304, U+0308, U+0329, U+1D00-1DBF, U+1E00-1E9F, U+1EF2-1EFF, U+2020, U+20A0-20AB, U+20AD-20C0, U+2113, U+2C60-2C7F, U+A720-A7FF"
    }
   ]
  },
  "legenda": {
   "familia": "Fonte Teste",
   "peso": 700,
   "licenca": "OFL",
   "licenca_arquivo": "fontes/OFL.txt",
   "arquivos": [
    {
     "arquivo": "fontes/HankenGrotesk-latin.woff2",
     "peso": "400 700",
     "unicode_range": "U+0000-00FF, U+0131, U+0152-0153, U+02BB-02BC, U+02C6, U+02DA, U+02DC, U+0304, U+0308, U+0329, U+2000-206F, U+20AC, U+2122, U+2191, U+2193, U+2212, U+2215, U+FEFF, U+FFFD"
    },
    {
     "arquivo": "fontes/HankenGrotesk-latin-ext.woff2",
     "peso": "400 700",
     "unicode_range": "U+0100-02BA, U+02BD-02C5, U+02C7-02CC, U+02CE-02D7, U+02DD-02FF, U+0304, U+0308, U+0329, U+1D00-1DBF, U+1E00-1E9F, U+1EF2-1EFF, U+2020, U+20A0-20AB, U+20AD-20C0, U+2113, U+2C60-2C7F, U+A720-A7FF"
    }
   ]
  },
  "texto": {
   "familia": "Fonte Teste",
   "peso": 600,
   "licenca": "OFL",
   "licenca_arquivo": "fontes/OFL.txt",
   "arquivos": [
    {
     "arquivo": "fontes/HankenGrotesk-latin.woff2",
     "peso": "400 700",
     "unicode_range": "U+0000-00FF, U+0131, U+0152-0153, U+02BB-02BC, U+02C6, U+02DA, U+02DC, U+0304, U+0308, U+0329, U+2000-206F, U+20AC, U+2122, U+2191, U+2193, U+2212, U+2215, U+FEFF, U+FFFD"
    },
    {
     "arquivo": "fontes/HankenGrotesk-latin-ext.woff2",
     "peso": "400 700",
     "unicode_range": "U+0100-02BA, U+02BD-02C5, U+02C7-02CC, U+02CE-02D7, U+02DD-02FF, U+0304, U+0308, U+0329, U+1D00-1DBF, U+1E00-1E9F, U+1EF2-1EFF, U+2020, U+20A0-20AB, U+20AD-20C0, U+2113, U+2C60-2C7F, U+A720-A7FF"
    }
   ]
  },
  "travar_peso": true
 },
 "logos": {
  "claro": "logos/logo-claro.svg",
  "escuro": "logos/logo-escuro.svg",
  "simbolo": "logos/simbolo.svg"
 },
 "legenda": {
  "forma": "bloco",
  "caixa_alta": false,
  "modo": "legenda-destaque"
 },
 "palco": {
  "fundo": "pontos",
  "energia": "alta"
 },
 "transicoes": {
  "evitar": [
   "glitch",
   "iris"
  ],
  "trocar_por": "slide-curto"
 },
 "texto": {
  "caixa": "frase",
  "vetadas": [
   "garantido"
  ],
  "travessao": false
 },
 "imagens": {
  "rostos": "ficticio"
 },
 "video": {
  "gancho": true,
  "final": "encerramento",
  "encerramento": {
   "assinatura": "Empresa Exemplo",
   "pedido": "Fale com a gente",
   "site": "exemplo.com"
  }
 },
 "marcador": {
  "tipo": "simbolo"
 },
 "proibido": {
  "cores": [],
  "fontes": [],
  "efeitos": []
 },
 "qa_estilo": "Kit de teste: fundo claro de papel, texto quase preto, um destaque azul por quadro."
}
